{
  "language": "ar",
  "steps": [
    {
      "id": "med-1",
      "text": "تناول Furosemide 40 mg مرة واحدة في اليوم، في الصباح"
    },
    {
      "id": "med-2",
      "text": "تناول Losartan 25 mg مرة واحدة في اليوم"
    },
    {
      "id": "med-3",
      "text": "تناول Empagliflozin 10 mg مرة واحدة في اليوم"
    },
    {
      "id": "med-4",
      "text": "تناول Amoxicillin-clavulanate 875/125 mg مرتين في اليوم حتى ينتهي (الأيام 3 القادمة)"
    },
    {
      "id": "med-5",
      "text": "توقف عن lisinopril. أبقِ spironolactone متوقفًا حتى يقول لك طبيبك غير ذلك"
    },
    {
      "id": "vital-1",
      "text": "زن نفسك كل صباح في نفس الوقت، واكتب الوزن وكيف تشعر"
    },
    {
      "id": "lab-1",
      "text": "أجرِ فحص الدم للكلى والبوتاسيوم (اللوحة الأيضية الأساسية) قبل أو عند أول زيارة متابعة (خلال 1 أسبوع)"
    },
    {
      "id": "appt-1",
      "text": "راجع طبيب الرعاية الأولية (خلال حوالي 1 أسبوع)"
    },
    {
      "id": "appt-2",
      "text": "راجع طبيب القلب (خلال حوالي 1 أسبوع)"
    },
    {
      "id": "life-1",
      "text": "اتبع نظامًا غذائيًا قليل الملح: حوالي 2 غرام من الصوديوم في اليوم"
    },
    {
      "id": "life-2",
      "text": "التزم بحدود السوائل التي أعطاك إياها فريق قصور القلب"
    }
  ],
  "medications": [
    {
      "name": "Furosemide",
      "dose": "40 mg",
      "howOften": "مرة واحدة في اليوم عن طريق الفم",
      "status": "new",
      "why": "حبة مدرة للبول. تساعد جسمك على التخلص من السوائل الزائدة لتتنفس بسهولة أكبر. ستتبول أكثر؛ تناولها في الصباح."
    },
    {
      "name": "Losartan",
      "dose": "25 mg",
      "howOften": "مرة واحدة في اليوم عن طريق الفم",
      "status": "new",
      "why": "يساعد قلبك ويخفض ضغط الدم. يحل محل lisinopril."
    },
    {
      "name": "Empagliflozin",
      "dose": "10 mg",
      "howOften": "مرة واحدة في اليوم عن طريق الفم",
      "status": "new",
      "why": "يساعد قلبك ومرض السكري لديك."
    },
    {
      "name": "Amoxicillin-clavulanate",
      "dose": "875/125 mg",
      "howOften": "مرتين في اليوم عن طريق الفم لمدة 3 أيام أخرى",
      "status": "new",
      "why": "مضاد حيوي لإكمال علاج الالتهاب الرئوي. تناول كل جرعة حتى لو شعرت بتحسن."
    },
    {
      "name": "Metoprolol succinate",
      "dose": "50 mg",
      "howOften": "مرة واحدة في اليوم",
      "status": "continue",
      "why": "يبطئ قلبك ويساعده على الضخ بشكل أفضل."
    },
    {
      "name": "Apixaban",
      "dose": "5 mg",
      "howOften": "مرتين في اليوم",
      "status": "continue",
      "why": "مميع للدم يمنع الجلطات الناتجة عن عدم انتظام ضربات القلب. انتبه لأي نزيف."
    },
    {
      "name": "Atorvastatin",
      "dose": "40 mg",
      "howOften": "كل ليلة",
      "status": "continue",
      "why": "يخفض الكوليسترول لحماية قلبك."
    },
    {
      "name": "Metformin",
      "dose": "500 mg",
      "howOften": "مرتين في اليوم",
      "status": "continue",
      "why": "يضبط سكر الدم. استمر في تناوله ما دامت فحوصات الكلى مستقرة."
    },
    {
      "name": "Lisinopril",
      "dose": "",
      "howOften": "",
      "status": "stop",
      "why": "تم إيقافه. Losartan يقوم بهذه المهمة الآن، فلا تتناول الاثنين."
    },
    {
      "name": "Spironolactone",
      "dose": "",
      "howOften": "",
      "status": "stop",
      "why": "متوقف حتى يراجع طبيبك فحوصات الكلى والبوتاسيوم. لا تعاود تناوله من تلقاء نفسك."
    },
    {
      "name": "Ibuprofen/other NSAIDs",
      "dose": "",
      "howOften": "",
      "status": "stop",
      "why": "تجنب مسكنات الألم مثل الإيبوبروفين. قد تضر قلبك وكليتيك. اسأل طبيبك قبل تناول أي منها."
    }
  ],
  "followUps": [
    {
      "who": "طبيب الرعاية الأولية",
      "when": "خلال حوالي 1 أسبوع",
      "why": "متابعة تعافيك وفحوصات الكلى وأدويتك"
    },
    {
      "who": "طبيب القلب",
      "when": "خلال حوالي 1 أسبوع",
      "why": "مراجعة خطة قصور القلب وتحديد موعد العودة إلى spironolactone"
    },
    {
      "who": "فريق قصور القلب",
      "when": "فورًا إذا ارتفع وزنك بسرعة",
      "why": "تعديل حبة إدرار البول قبل أن تتراكم السوائل مرة أخرى"
    }
  ],
  "warnings": [
    {
      "text": "ألم أو ضغط في الصدر",
      "tier": "call911"
    },
    {
      "text": "إغماء أو دوخة شديدة",
      "tier": "call911"
    },
    {
      "text": "ارتباك جديد أو ضعف شديد",
      "tier": "call911"
    },
    {
      "text": "ضيق شديد في التنفس، خاصة أثناء الراحة",
      "tier": "call911"
    },
    {
      "text": "تورم سريع في الساقين أو البطن",
      "tier": "er"
    },
    {
      "text": "كمية بول أقل بكثير من المعتاد",
      "tier": "er"
    },
    {
      "text": "حمى أو سعال يزداد سوءًا رغم المضاد الحيوي",
      "tier": "er"
    },
    {
      "text": "زيادة سريعة في الوزن أو تورم أكثر أو ضيق تنفس، حسب خطة الوزن التي أعطاك إياها فريق قصور القلب",
      "tier": "clinic"
    },
    {
      "text": "أي نزيف يقلقك أثناء تناول apixaban",
      "tier": "clinic"
    },
    {
      "text": "قبل البدء بأي دواء جديد، بما في ذلك مسكنات الألم التي تُصرف دون وصفة",
      "tier": "clinic"
    }
  ]
}
