{
  "language": "en",
  "steps": [
    {
      "id": "med-1",
      "text": "Take Furosemide 40 mg once a day, in the morning"
    },
    {
      "id": "med-2",
      "text": "Take Losartan 25 mg once a day"
    },
    {
      "id": "med-3",
      "text": "Take Empagliflozin 10 mg once a day"
    },
    {
      "id": "med-4",
      "text": "Take Amoxicillin-clavulanate 875/125 mg twice a day until it is gone (next 3 days)"
    },
    {
      "id": "med-5",
      "text": "Stop lisinopril. Keep spironolactone on hold until your doctor says otherwise"
    },
    {
      "id": "vital-1",
      "text": "Weigh yourself every morning at the same time and write it down with how you feel"
    },
    {
      "id": "lab-1",
      "text": "Get your kidney and potassium blood test (basic metabolic panel) before or at your first follow-up visit (within 1 week)"
    },
    {
      "id": "appt-1",
      "text": "See your primary care doctor (within about 1 week)"
    },
    {
      "id": "appt-2",
      "text": "See your heart doctor (cardiology) (within about 1 week)"
    },
    {
      "id": "life-1",
      "text": "Eat a low-salt diet: about 2 grams of sodium a day"
    },
    {
      "id": "life-2",
      "text": "Follow the fluid limits the heart-failure team gave you"
    }
  ],
  "medications": [
    {
      "name": "Furosemide",
      "dose": "40 mg",
      "howOften": "once a day by mouth",
      "status": "new",
      "why": "A water pill. It helps your body get rid of extra fluid so you breathe easier. You will urinate more; take it in the morning."
    },
    {
      "name": "Losartan",
      "dose": "25 mg",
      "howOften": "once a day by mouth",
      "status": "new",
      "why": "Helps your heart and keeps your blood pressure down. It replaces lisinopril."
    },
    {
      "name": "Empagliflozin",
      "dose": "10 mg",
      "howOften": "once a day by mouth",
      "status": "new",
      "why": "Helps your heart and your diabetes."
    },
    {
      "name": "Amoxicillin-clavulanate",
      "dose": "875/125 mg",
      "howOften": "twice a day by mouth for 3 more days",
      "status": "new",
      "why": "An antibiotic to finish treating your pneumonia. Take every dose even if you feel better."
    },
    {
      "name": "Metoprolol succinate",
      "dose": "50 mg",
      "howOften": "once a day",
      "status": "continue",
      "why": "Slows your heart and helps it pump better."
    },
    {
      "name": "Apixaban",
      "dose": "5 mg",
      "howOften": "twice a day",
      "status": "continue",
      "why": "A blood thinner that prevents clots from your irregular heartbeat. Watch for bleeding."
    },
    {
      "name": "Atorvastatin",
      "dose": "40 mg",
      "howOften": "every night",
      "status": "continue",
      "why": "Lowers cholesterol to protect your heart."
    },
    {
      "name": "Metformin",
      "dose": "500 mg",
      "howOften": "twice a day",
      "status": "continue",
      "why": "Controls your blood sugar. Keep taking it as long as your kidney tests stay stable."
    },
    {
      "name": "Lisinopril",
      "dose": "",
      "howOften": "",
      "status": "stop",
      "why": "Stopped. Losartan now does this job, so do not take both."
    },
    {
      "name": "Spironolactone",
      "dose": "",
      "howOften": "",
      "status": "stop",
      "why": "On hold until your doctor checks your kidney and potassium blood tests. Do not restart it on your own."
    },
    {
      "name": "Ibuprofen/other NSAIDs",
      "dose": "",
      "howOften": "",
      "status": "stop",
      "why": "Avoid pain relievers like ibuprofen. They can hurt your heart and kidneys. Ask your doctor before taking any."
    }
  ],
  "followUps": [
    {
      "who": "Primary care doctor",
      "when": "within about 1 week",
      "why": "Check your recovery, your kidney tests and your medicines"
    },
    {
      "who": "Cardiology (heart doctor)",
      "when": "within about 1 week",
      "why": "Check your heart failure plan and decide when to restart spironolactone"
    },
    {
      "who": "Heart-failure team",
      "when": "right away if your weight rises fast",
      "why": "Adjust your water pill before fluid builds up again"
    }
  ],
  "warnings": [
    {
      "text": "Chest pain or pressure",
      "tier": "call911"
    },
    {
      "text": "Fainting or severe dizziness",
      "tier": "call911"
    },
    {
      "text": "New confusion or severe weakness",
      "tier": "call911"
    },
    {
      "text": "Severe shortness of breath, especially at rest",
      "tier": "call911"
    },
    {
      "text": "Legs or belly swelling up quickly",
      "tier": "er"
    },
    {
      "text": "Making much less urine than usual",
      "tier": "er"
    },
    {
      "text": "Fever or a cough that gets worse even with the antibiotic",
      "tier": "er"
    },
    {
      "text": "Fast weight gain or more swelling or breathlessness, following the weight plan your heart-failure team gave you",
      "tier": "clinic"
    },
    {
      "text": "Any bleeding that worries you while taking apixaban",
      "tier": "clinic"
    },
    {
      "text": "Before starting any new medicine, including over-the-counter pain relievers",
      "tier": "clinic"
    }
  ]
}
