{
  "language": "es",
  "steps": [
    {
      "id": "med-1",
      "text": "Tome Furosemide 40 mg una vez al día, por la mañana"
    },
    {
      "id": "med-2",
      "text": "Tome Losartan 25 mg una vez al día"
    },
    {
      "id": "med-3",
      "text": "Tome Empagliflozin 10 mg una vez al día"
    },
    {
      "id": "med-4",
      "text": "Tome Amoxicillin-clavulanate 875/125 mg dos veces al día hasta terminarlo (próximos 3 días)"
    },
    {
      "id": "med-5",
      "text": "Deje de tomar lisinopril. Mantenga spironolactone en pausa hasta que su médico le diga"
    },
    {
      "id": "vital-1",
      "text": "Pésese cada mañana a la misma hora y anote el peso y cómo se siente"
    },
    {
      "id": "lab-1",
      "text": "Hágase la prueba de sangre de riñón y potasio (panel metabólico básico) antes o en su primera cita de seguimiento (dentro de 1 semana)"
    },
    {
      "id": "appt-1",
      "text": "Vea a su médico de cabecera (dentro de aproximadamente 1 semana)"
    },
    {
      "id": "appt-2",
      "text": "Vea a su médico del corazón (cardiología) (dentro de aproximadamente 1 semana)"
    },
    {
      "id": "life-1",
      "text": "Coma con poca sal: unos 2 gramos de sodio al día"
    },
    {
      "id": "life-2",
      "text": "Siga los límites de líquidos que le dio el equipo de insuficiencia cardíaca"
    }
  ],
  "medications": [
    {
      "name": "Furosemide",
      "dose": "40 mg",
      "howOften": "una vez al día por la boca",
      "status": "new",
      "why": "Una pastilla para orinar. Ayuda a su cuerpo a sacar el líquido de más para que respire mejor. Orinará más; tómela por la mañana."
    },
    {
      "name": "Losartan",
      "dose": "25 mg",
      "howOften": "una vez al día por la boca",
      "status": "new",
      "why": "Ayuda a su corazón y mantiene baja su presión arterial. Reemplaza a lisinopril."
    },
    {
      "name": "Empagliflozin",
      "dose": "10 mg",
      "howOften": "una vez al día por la boca",
      "status": "new",
      "why": "Ayuda a su corazón y a su diabetes."
    },
    {
      "name": "Amoxicillin-clavulanate",
      "dose": "875/125 mg",
      "howOften": "dos veces al día por la boca por 3 días más",
      "status": "new",
      "why": "Un antibiótico para terminar de tratar su neumonía. Tome cada dosis aunque se sienta mejor."
    },
    {
      "name": "Metoprolol succinate",
      "dose": "50 mg",
      "howOften": "una vez al día",
      "status": "continue",
      "why": "Hace más lento su corazón y lo ayuda a bombear mejor."
    },
    {
      "name": "Apixaban",
      "dose": "5 mg",
      "howOften": "dos veces al día",
      "status": "continue",
      "why": "Un anticoagulante que evita coágulos por su latido irregular. Esté atento a sangrados."
    },
    {
      "name": "Atorvastatin",
      "dose": "40 mg",
      "howOften": "cada noche",
      "status": "continue",
      "why": "Baja el colesterol para proteger su corazón."
    },
    {
      "name": "Metformin",
      "dose": "500 mg",
      "howOften": "dos veces al día",
      "status": "continue",
      "why": "Controla su azúcar en la sangre. Siga tomándola mientras sus pruebas de riñón sigan estables."
    },
    {
      "name": "Lisinopril",
      "dose": "",
      "howOften": "",
      "status": "stop",
      "why": "Suspendido. Losartan ahora hace este trabajo, así que no tome los dos."
    },
    {
      "name": "Spironolactone",
      "dose": "",
      "howOften": "",
      "status": "stop",
      "why": "En pausa hasta que su médico revise sus pruebas de sangre de riñón y potasio. No la vuelva a tomar por su cuenta."
    },
    {
      "name": "Ibuprofen/other NSAIDs",
      "dose": "",
      "howOften": "",
      "status": "stop",
      "why": "Evite calmantes como el ibuprofeno. Pueden dañar su corazón y sus riñones. Pregunte a su médico antes de tomar alguno."
    }
  ],
  "followUps": [
    {
      "who": "Médico de cabecera",
      "when": "dentro de aproximadamente 1 semana",
      "why": "Revisar su recuperación, sus pruebas de riñón y sus medicinas"
    },
    {
      "who": "Cardiología (médico del corazón)",
      "when": "dentro de aproximadamente 1 semana",
      "why": "Revisar su plan de insuficiencia cardíaca y decidir cuándo volver a tomar spironolactone"
    },
    {
      "who": "Equipo de insuficiencia cardíaca",
      "when": "de inmediato si su peso sube rápido",
      "why": "Ajustar su pastilla para orinar antes de que el líquido se acumule otra vez"
    }
  ],
  "warnings": [
    {
      "text": "Dolor o presión en el pecho",
      "tier": "call911"
    },
    {
      "text": "Desmayo o mareo fuerte",
      "tier": "call911"
    },
    {
      "text": "Confusión nueva o debilidad fuerte",
      "tier": "call911"
    },
    {
      "text": "Falta de aire severa, sobre todo en reposo",
      "tier": "call911"
    },
    {
      "text": "Las piernas o el abdomen se hinchan rápido",
      "tier": "er"
    },
    {
      "text": "Orina mucho menos de lo normal",
      "tier": "er"
    },
    {
      "text": "Fiebre o una tos que empeora aun con el antibiótico",
      "tier": "er"
    },
    {
      "text": "Aumento rápido de peso o más hinchazón o falta de aire, siguiendo el plan de peso que le dio su equipo de insuficiencia cardíaca",
      "tier": "clinic"
    },
    {
      "text": "Cualquier sangrado que le preocupe mientras toma apixaban",
      "tier": "clinic"
    },
    {
      "text": "Antes de empezar cualquier medicina nueva, incluidos calmantes sin receta",
      "tier": "clinic"
    }
  ]
}
