{
  "language": "en",
  "steps": [
    {
      "id": "med-1",
      "text": "Take Torsemide 20 mg once a day. Do not take furosemide anymore"
    },
    {
      "id": "med-2",
      "text": "Take Metoprolol succinate 75 mg once a day. Do not take the old metoprolol"
    },
    {
      "id": "med-3",
      "text": "Take Cephalexin 500 mg four times a day until it is gone (next 4 days)"
    },
    {
      "id": "med-4",
      "text": "Take Empagliflozin 10 mg once a day"
    },
    {
      "id": "med-5",
      "text": "Take Apixaban 5 mg twice a day, every day"
    },
    {
      "id": "vital-1",
      "text": "Weigh yourself every day and write it down"
    },
    {
      "id": "vital-2",
      "text": "Look at your right leg every day: redness, warmth and swelling should be shrinking"
    },
    {
      "id": "lab-1",
      "text": "Get your kidney and electrolyte blood tests as ordered after the water pill change"
    },
    {
      "id": "appt-1",
      "text": "See your heart doctor (cardiology) (as arranged)"
    },
    {
      "id": "appt-2",
      "text": "See your primary care doctor (as arranged)"
    },
    {
      "id": "life-1",
      "text": "Eat a low-salt diet"
    },
    {
      "id": "life-2",
      "text": "Put your right leg up when resting"
    }
  ],
  "medications": [
    {
      "name": "Torsemide",
      "dose": "20 mg",
      "howOften": "once a day by mouth",
      "status": "new",
      "why": "Your new water pill. It replaces furosemide and takes extra fluid off. You will urinate more."
    },
    {
      "name": "Metoprolol succinate",
      "dose": "75 mg",
      "howOften": "once a day",
      "status": "new",
      "why": "A long-acting version that keeps your heart rate steady. It replaces the old short-acting metoprolol."
    },
    {
      "name": "Cephalexin",
      "dose": "500 mg",
      "howOften": "four times a day for 4 more days",
      "status": "new",
      "why": "An antibiotic to finish treating the leg infection. Take every dose."
    },
    {
      "name": "Empagliflozin",
      "dose": "10 mg",
      "howOften": "once a day",
      "status": "new",
      "why": "Helps your heart failure."
    },
    {
      "name": "Apixaban",
      "dose": "5 mg",
      "howOften": "twice a day, as on your final medication list",
      "status": "continue",
      "why": "A blood thinner that prevents strokes from the irregular heartbeat. Never stop it without asking your doctor."
    },
    {
      "name": "Amlodipine",
      "dose": "",
      "howOften": "as instructed",
      "status": "continue",
      "why": "Keeps your blood pressure down."
    },
    {
      "name": "Atorvastatin",
      "dose": "",
      "howOften": "every night",
      "status": "continue",
      "why": "Lowers cholesterol to protect your heart."
    },
    {
      "name": "Home diabetes regimen",
      "dose": "",
      "howOften": "as on your final medication list",
      "status": "continue",
      "why": "Controls your blood sugar."
    },
    {
      "name": "Furosemide",
      "dose": "",
      "howOften": "",
      "status": "stop",
      "why": "Stopped. Torsemide replaces it. Do not take both water pills."
    },
    {
      "name": "Previous short-acting metoprolol regimen",
      "dose": "",
      "howOften": "",
      "status": "stop",
      "why": "Stopped. The new once-a-day metoprolol succinate replaces it."
    }
  ],
  "followUps": [
    {
      "who": "Cardiology (heart doctor)",
      "when": "as arranged",
      "why": "Check your heart rate, fluid and the new medicines"
    },
    {
      "who": "Primary care doctor",
      "when": "as arranged",
      "why": "Check the leg infection and your blood tests"
    }
  ],
  "warnings": [
    {
      "text": "New chest pain",
      "tier": "call911"
    },
    {
      "text": "Severe or quickly worsening shortness of breath",
      "tier": "call911"
    },
    {
      "text": "Fainting or nearly fainting",
      "tier": "call911"
    },
    {
      "text": "New confusion or severe weakness",
      "tier": "call911"
    },
    {
      "text": "A fast or irregular heartbeat that does not settle and makes you feel unwell",
      "tier": "er"
    },
    {
      "text": "Swelling or weight going up quickly",
      "tier": "er"
    },
    {
      "text": "The leg redness spreading past the marked line, or the pain getting much worse fast",
      "tier": "er"
    },
    {
      "text": "New fever or chills",
      "tier": "er"
    },
    {
      "text": "Heavy bleeding while on the blood thinner",
      "tier": "er"
    },
    {
      "text": "Dizziness or blood pressure changes, so we can check your fall risk",
      "tier": "clinic"
    },
    {
      "text": "Any new drainage from the leg",
      "tier": "clinic"
    }
  ]
}
