{
  "language": "en",
  "steps": [
    {
      "id": "med-1",
      "text": "Get every IV Cefazolin dose on the schedule from the infectious-disease team (every scheduled dose until the course is complete)"
    },
    {
      "id": "med-2",
      "text": "Take Furosemide 40 mg once a day"
    },
    {
      "id": "med-3",
      "text": "Take Losartan 25 mg once a day"
    },
    {
      "id": "vital-1",
      "text": "Weigh yourself every day and watch for swelling or breathlessness"
    },
    {
      "id": "vital-2",
      "text": "Check your PICC line site every day for redness, drainage or bleeding"
    },
    {
      "id": "lab-1",
      "text": "Get the blood tests on your outpatient antibiotic plan (as scheduled)"
    },
    {
      "id": "appt-1",
      "text": "Go to all infectious-disease appointments (as scheduled)"
    },
    {
      "id": "appt-2",
      "text": "Go to all cardiology (heart doctor) appointments (as scheduled)"
    },
    {
      "id": "appt-3",
      "text": "Keep your PICC line care appointments (as scheduled)"
    },
    {
      "id": "life-1",
      "text": "Eat a low-salt diet and follow your fluid plan"
    },
    {
      "id": "life-2",
      "text": "Follow any activity limits and dental-procedure advice from your teams"
    }
  ],
  "medications": [
    {
      "name": "Cefazolin",
      "dose": "",
      "howOften": "through your IV line, at the dose and schedule the infectious-disease team gave you",
      "status": "new",
      "why": "The antibiotic that kills the valve infection. Every dose matters. Do not stop or change it on your own."
    },
    {
      "name": "Furosemide",
      "dose": "40 mg",
      "howOften": "once a day by mouth",
      "status": "new",
      "why": "A water pill that keeps fluid from building up. You will urinate more."
    },
    {
      "name": "Losartan",
      "dose": "25 mg",
      "howOften": "once a day",
      "status": "new",
      "why": "Helps your heart, started at a low dose because your blood pressure and kidneys are still recovering."
    },
    {
      "name": "Metoprolol succinate",
      "dose": "",
      "howOften": "at the dose on your discharge list",
      "status": "continue",
      "why": "Helps your heart pump better."
    },
    {
      "name": "Other chronic medications",
      "dose": "",
      "howOften": "as on your final medication list",
      "status": "continue",
      "why": "Your usual long-term medicines."
    },
    {
      "name": "Empiric inpatient antibiotics",
      "dose": "",
      "howOften": "",
      "status": "stop",
      "why": "Stopped. The hospital antibiotics were replaced by cefazolin, which targets your exact infection."
    },
    {
      "name": "NSAIDs",
      "dose": "",
      "howOften": "",
      "status": "stop",
      "why": "Avoid pain relievers like ibuprofen unless your doctor says it is okay. They can hurt your heart and kidneys."
    }
  ],
  "followUps": [
    {
      "who": "Infectious-disease team",
      "when": "as scheduled",
      "why": "Track the antibiotic course and blood tests"
    },
    {
      "who": "Cardiology (heart doctor)",
      "when": "as scheduled",
      "why": "Check your heart valve and heart failure plan"
    },
    {
      "who": "Outpatient infusion and PICC care team",
      "when": "as scheduled",
      "why": "Give the IV antibiotic and care for the line"
    }
  ],
  "warnings": [
    {
      "text": "New weakness, a drooping face, trouble speaking, or confusion (signs of stroke)",
      "tier": "call911"
    },
    {
      "text": "Chest pain",
      "tier": "call911"
    },
    {
      "text": "Fainting or severe dizziness",
      "tier": "call911"
    },
    {
      "text": "Sudden severe back, chest or belly pain",
      "tier": "call911"
    },
    {
      "text": "Fever, chills, or feeling very sick again",
      "tier": "er"
    },
    {
      "text": "New or worsening shortness of breath",
      "tier": "er"
    },
    {
      "text": "Swelling or weight going up quickly",
      "tier": "er"
    },
    {
      "text": "Bleeding, a lot of drainage, or redness around the PICC line",
      "tier": "er"
    },
    {
      "text": "Any problem with the IV line, such as it will not flush or looks damaged",
      "tier": "clinic"
    },
    {
      "text": "A missed antibiotic dose",
      "tier": "clinic"
    },
    {
      "text": "Questions about your medicines after discharge",
      "tier": "clinic"
    }
  ]
}
